{
  "assertions_to_pass_state_true": [
    "cash_bill_guard_enabled",
    "control_spend_within_target",
    "queue_exposure_zero_during_preflight",
    "service_tail_risk_zero_during_preflight",
    "teardown_debt_zero_during_preflight",
    "ineligible_charge_reserve_covers_target",
    "target_credit_conversion_usd_fixed",
    "simulation_id_present",
    "spend_program_target_match",
    "spend_program_planned_sum_match",
    "spend_program_offline_mode",
    "spend_program_live_execution_blocked",
    "spend_program_gate_state_blocked",
    "noop_plan_offline_only",
    "noop_plan_account_pinned",
    "canary_attestation_program_match",
    "canary_pre_flip_locked",
    "canary_guard_invariant_total_lt_program_target",
    "preflight_target_matches_spend_program",
    "release_manifest_no_aws_runtime_dep",
    "policy_trust_csv_boundaries_artifact_present",
    "billing_event_ledger_schema_append_only"
  ],
  "cash_bill_guard_enabled": true,
  "control_spend_usd": 0.0,
  "ineligible_charge_uncertainty_reserve_usd": 19490.0,
  "pass_state": true,
  "pass_state_flip_authority": "preflight_runner",
  "queue_exposure_usd": 0.0,
  "service_tail_risk_usd": 0.0,
  "simulation_id": "rc1-p0-bootstrap-2026-05-15:spend-simulation",
  "target_credit_conversion_usd": 19490,
  "teardown_debt_usd": 0.0
}
